{
  "schemaVersion": 1,
  "problemId": "bssc-sum-capacity",
  "subjectTransactionId": "5ed3f525b9ae7f32c6e1dcbf22ecdb5ae946a4a6",
  "acceptedClaimRefs": [
    {
      "transactionId": "5ed3f525b9ae7f32c6e1dcbf22ecdb5ae946a4a6",
      "claimKey": "bssc-sum-capacity/conditional-product-marton-no-gain",
      "judgmentId": "sha256:fb042c476afdbb03551bcf3dcb05c4cc1ab3d2eeeee845e1d5031ebfb44d1c65",
      "assessmentDigest": "sha256:d4d276f8ffcd9f5daaa760b9cfece276dce60c24e32629b6f9c3e33fc3bbc917"
    }
  ],
  "knowledgeStateDigest": "sha256:6b0bfe02cc7057a02942c7010c98bfdb1a8391a1aca46b5e709c5c1c0c4a3369",
  "subjectEvidenceManifestDigest": "sha256:059df67ceab76a406cf7dc16fe8f7a849342bc16ec3749c6d0e9f73b913fd512",
  "facts": [
    {
      "id": "conditional-product-tensorization",
      "condition": "If receiver roles are interchangeable by channel relabelings and fixing the cloud auxiliary separates the coordinate-level satellite/input packets, then the best block Marton sum expression within that subclass is the sum of the one-use optima.",
      "actorVisibility": "withheld-until-independent-discovery",
      "affectedNodeRefs": [
        {
          "kind": "program",
          "id": "root/multiletter-marton-achievability"
        },
        {
          "kind": "thread",
          "id": "root/multiletter-marton-achievability/support-pruning"
        }
      ],
      "acceptedClaimKeys": [
        "bssc-sum-capacity/conditional-product-marton-no-gain"
      ]
    },
    {
      "id": "correlation-balance-screen",
      "condition": "For any selected tuple decomposition of a correlated block candidate, improvement requires the decomposition-specific correlation residual to pass the claim's strict balance test; passing that test alone does not establish improvement.",
      "actorVisibility": "withheld-until-independent-discovery",
      "affectedNodeRefs": [
        {
          "kind": "thread",
          "id": "root/multiletter-marton-achievability/support-pruning"
        },
        {
          "kind": "thread",
          "id": "root/multiletter-marton-achievability/unstructured-search"
        }
      ],
      "acceptedClaimKeys": [
        "bssc-sum-capacity/conditional-product-marton-no-gain"
      ]
    },
    {
      "id": "cross-use-coupling-necessary",
      "condition": "A two-use half-skew BSSC candidate above the additive one-use benchmark must retain dependence between coordinate packets after its cloud auxiliary is fixed.",
      "actorVisibility": "withheld-until-independent-discovery",
      "affectedNodeRefs": [
        {
          "kind": "thread",
          "id": "root/multiletter-marton-achievability/support-pruning"
        },
        {
          "kind": "thread",
          "id": "root/multiletter-marton-achievability/unstructured-search"
        }
      ],
      "acceptedClaimKeys": [
        "bssc-sum-capacity/conditional-product-marton-no-gain"
      ]
    }
  ],
  "assumptions": [
    "All channel and auxiliary alphabets are finite.",
    "The additivity conclusion is limited to the conditionally separated subclass and does not cover unrestricted correlated block laws.",
    "The channel extension is memoryless and the blocklength is finite.",
    "The standard private-message Marton sum functional is used."
  ],
  "safeFactsDigest": "sha256:6b750c2debd433af75ca9ae7b7c88d8ee48cf8c4edca012bcb3d80a5d2d2c7cc"
}
